{
  "$schema": "https://regesta.io/schema/v0.1/procedure.schema.json",
  "schema_version": "0.1.0",
  "id": "2025/2829(RPS)",
  "slug": "2025-2829-rps",
  "type": "RPS",
  "title": "Commission Decision amending Decisions 2014/350/EU, 2014/391/EU, (EU) 2016/1332, (EU) 2016/1349 and (EU) 2017/176 as regards the period of validity of the EU Ecolabel criteria and the related assessment and verification requirements for textile products, bed mattresses, furniture, footwear and wood-, cork-, and bamboo-based floor coverings",
  "status": "ongoing",
  "institution_leads": {
    "commission_dg": null,
    "ep_committees": []
  },
  "provenance": {
    "status": "official"
  },
  "sources": [
    {
      "source": "ep_api",
      "url": "https://data.europarl.europa.eu/api/v2/procedures/2025-2829?format=application%2Fld%2Bjson",
      "ref": "eli/dl/proc/2025-2829",
      "retrieved": "2026-10-19T18:18:47Z",
      "license": "CC-BY-4.0",
      "legal_basis": "European Parliament Bureau decision of 16.12.2024 on open data, OJ C/2025/341, Art. 4"
    }
  ],
  "license": "CC-BY-4.0",
  "modified": false,
  "valid_from": "manual-2026-10-19",
  "valid_to": null,
  "identifiers": [
    {
      "alias_type": "ep_proc",
      "alias": "2025/2829(RPS)",
      "provenance": {
        "status": "official"
      },
      "sources": [
        {
          "source": "ep_api",
          "url": "https://data.europarl.europa.eu/api/v2/procedures/2025-2829?format=application%2Fld%2Bjson",
          "ref": "eli/dl/proc/2025-2829",
          "retrieved": "2026-10-19T18:18:47Z",
          "license": "CC-BY-4.0",
          "legal_basis": "European Parliament Bureau decision of 16.12.2024 on open data, OJ C/2025/341, Art. 4"
        }
      ],
      "license": "CC-BY-4.0",
      "modified": false,
      "valid_from": "manual-2026-10-19",
      "valid_to": null
    },
    {
      "alias_type": "ep_proc_id",
      "alias": "2025-2829",
      "provenance": {
        "status": "official"
      },
      "sources": [
        {
          "source": "ep_api",
          "url": "https://data.europarl.europa.eu/api/v2/procedures/2025-2829?format=application%2Fld%2Bjson",
          "ref": "eli/dl/proc/2025-2829",
          "retrieved": "2026-10-19T18:18:47Z",
          "license": "CC-BY-4.0",
          "legal_basis": "European Parliament Bureau decision of 16.12.2024 on open data, OJ C/2025/341, Art. 4"
        }
      ],
      "license": "CC-BY-4.0",
      "modified": false,
      "valid_from": "manual-2026-10-19",
      "valid_to": null
    }
  ],
  "steps": [
    {
      "id": "2025-2829-ANPRO-2025-09-10",
      "institution": "parliament",
      "kind": "referral",
      "source_kind": "REFERRAL",
      "date": "2025-09-10",
      "date_precision": "day",
      "provenance": {
        "status": "official"
      },
      "sources": [
        {
          "source": "ep_api",
          "url": "https://data.europarl.europa.eu/api/v2/procedures/2025-2829?format=application%2Fld%2Bjson",
          "ref": "eli/dl/event/2025-2829-ANPRO-2025-09-10",
          "retrieved": "2026-10-19T18:18:47Z",
          "license": "CC-BY-4.0",
          "legal_basis": "European Parliament Bureau decision of 16.12.2024 on open data, OJ C/2025/341, Art. 4"
        }
      ],
      "license": "CC-BY-4.0",
      "modified": false,
      "valid_from": "manual-2026-10-19",
      "valid_to": null
    }
  ],
  "documents": [],
  "edges": [],
  "gaps": [],
  "people": "https://regesta.io/v1/procedures/2025-2829-rps/people",
  "attribution": {
    "text_de": "Daten: Regesta von Berth, CC BY 4.0. Bearbeitet aus Quellen der Europäischen Union (© Europäische Union: Europäisches Parlament, Europäische Kommission, Amt für Veröffentlichungen, Rat der EU). Abstimmungen: HowTheyVote.eu, ODbL 1.0. Keine amtliche Veröffentlichung. Quellen, Lizenzen und Haftungsausschluss: regesta.io/licences",
    "text_en": "Data: Regesta by Berth, CC BY 4.0. Adapted from European Union sources (© European Union: European Parliament, European Commission, Publications Office, Council of the EU). Votes: HowTheyVote.eu, ODbL 1.0. Not an official publication. Sources, licences and disclaimer: regesta.io/licences",
    "license": "CC-BY-4.0",
    "license_url": "https://creativecommons.org/licenses/by/4.0/",
    "licenses_page": "https://regesta.io/licences",
    "disclaimer_url": "https://regesta.io/licences#disclaimer",
    "official": false
  }
}